科大智能,300222,黄明松,董事长兼高管,"黄明松先生,中国国籍,未拥有永久境外居留权,1971年9月出生,硕士。曾任安徽科大鲁能科技有限公司董事长,安徽东财投资管理有限公司执行董事,安徽科大智能电网技术有限公司执行董事、总经理,四川科智得科技有限公司董事,科大智能(合肥)科技有限公司董事,上海永乾机电有限公司董事,科大智能科技股份有限公司总经理。现任科大智能科技股份有限公司董事长、总裁,上海复科智能机器人研究院有限公司董事,上海槟果资产管理有限公司执行董事,华艺生态园林股份有限公司董事。"
科大智能,300222,杨锐俊,董事兼高管,"杨锐俊先生,中国国籍,未拥有永久境外居留权,1972年1月出生,硕士。曾任上海科大鲁能集成科技有限公司总经理助理、研发中心主任,科大智能(合肥)科技有限公司董事长,科大智能电气技术有限公司执行董事,上海永乾机电有限公司董事,科大智能科技股份有限公司副总经理。现任科大智能科技股份有限公司董事、总裁,科大智能机器人技术有限公司执行董事兼总经理,安徽科大智能物流系统有限公司董事长,上海冠致工业自动化有限公司董事,华晓精密工业(苏州)有限公司董事,烟台正信电气有限公司董事,烟台科大正信电气有限公司董事,上海复科智能机器人研究院有限公司执行董事,深圳力子机器人有限公司董事,深圳博建电子科技有限公司董事,捷福装备(武汉)股份有限公司董事,BluewristInc公司董事。"
科大智能,300222,姚瑶,董事兼高管,姚瑶女士，中国国籍，未拥有永久境外居留权，1979年9月出生，大学本科。曾任安徽科大鲁能科技有限公司总经理助理兼行政总监，上海科大鲁能科技有限公司行政总监。现任上海科大智能科技股份有限公司董事、董事会秘书、行政总监，兼任安徽科大智能电网技术有限公司行政总监。其担任本公司董事的任期为2010年1月28日至2013年1月27日。
科大智能,300222,朱宁,董事兼高管,朱宁女士，中国国籍，未拥有永久境外居留权，1969年7月出生，大学本科。曾任安徽科大鲁能科技有限公司董事、财务经理，上海科大鲁能集成科技有限公司董事、副总经理。现任安徽东财投资管理有限公司董事，上海科大智能科技股份有限公司董事、副总经理，上海科大智能电气有限公司监事。其担任本公司董事的任期为2010年1月28日至2013年1月27日。
科大智能,300222,陈键,董事,"陈键先生,中国国籍,未拥有永久境外居留权,1966年5月出生,大学本科。曾任江南造船厂工程师,艾默生电器(中国)投资有限公司业务发展经理,上海永乾机电有限公司董事长、总经理。现任科大智能科技股份有限公司副董事长,上海冠致工业自动化有限公司董事。"
科大智能,300222,鲁兵,董事,"鲁兵先生,中国国籍,未拥有永久境外居留权,1978年11月出生,大学本科,工程师。曾任上海科大鲁能集成科技有限公司董事、副总经理。现任上海科大智能科技股份有限公司董事、副总经理。其担任本公司董事的任期为2010年1月28日至2013年1月27日。
"
科大智能,300222,应勇,董事,"应勇先生,中国国籍,未拥有永久境外居留权,1968年5月出生,硕士。曾任中科大资产经营有限责任公司总裁助理、董事会秘书、董事兼总经理,科大智能科技股份有限公司监事会主席。现任科大智能科技股份有限公司董事,中科大资产经营有限责任公司常务副总裁,科大国创软件股份有限公司董事,科大国盾量子技术股份有限公司董事,安徽问天量子科技股份有限公司董事,合肥本源量子计算科技有限责任公司董事,合肥科佳高分子材料科技有限公司董事,合肥华西科技开发有限公司董事,合肥国家大学科技园发展有限责任公司董事。"
科大智能,300222,蒋敏,独立董事,"蒋敏先生,中国国籍,未拥有永久境外居留权,1965年3月出生,法学硕士,一级律师。曾任安徽省律师协会会长,中国证监会第四、五届上市公司并购重组审核委员会委员。现任安徽天禾律师事务所创始合伙人,安徽省律师协会名誉会长,中华全国律师协会副会长,科大智能科技股份有限公司独立董事,青岛啤酒股份有限公司独立董事,山东省药用玻璃股份有限公司独立董事,阳光电源股份有限公司独立董事,青岛港国际股份有限公司独立董事。"
科大智能,300222,吕勇军,独立董事,吕勇军先生，中国国籍，未拥有永久境外居留权，1966年12月出生，研究生，中国注册会计师，会计师。曾任安徽精诚会计师事务所主任会计师，天健华证中洲会计师事务所、天健光华（北京）会计师事务所安徽分所总经理。现任天健正信会计师事务所安徽分所总经理、安徽省注册会计师协会常务理事、上海科大智能科技股份有限公司独立董事。其担任本公司董事的任期为2010年4月16日至2013年1月27日。
科大智能,300222,张焰,独立董事,张焰女士，中国国籍，未拥有永久境外居留权，1958年7月出生，电力系统及其自动化专业博士，教授，博士生导师。曾任上海交通大学电力工程系副主任、电气工程系主任、上海交通大学电力学院副院长。现任上海交通大学电子信息与电气工程学院副院长、中国电机工程学会理事、上海市电机工程学会理事、上海市电机工程学会供用电专委会副主任、《现代电力》杂志编委、上海科大智能科技股份有限公司独立董事。其担任本公司董事的任期为2010年4月16日至2013年1月27日。
科大智能,300222,李林,监事,"李林先生,中国国籍,未拥有永久境外居留权,1979年8月出生,硕士。曾先后主持“面向配电自动化领域的嵌入式应用系统”、“基于MSP430单片机和TMS320F2812DSP两种平台开发高性能的配电自动化终端”等多项公司科研项目的研发,主持或参与研发的项目“基于多CPU的电能量管理终端设计及关键技术研究”、“KD_200F馈线自动化终端设计及关键技术研究”、“基于32位DSP的电力负荷管理终端设计及关键技术研究”获得了安徽省科学技术成果奖,获得过多项专利成果。曾任安徽科大鲁能科技有限公司技术员、东财投资智能电网技术有限公司研发部经理。现任安徽科大智能电网技术有限公司研发总监。"
科大智能,300222,任建福,监事,任建福先生，中国国籍，未拥有永久境外居留权，1969年4月出生，硕士。一直从事电力系统自动化及工业自动化产品研发工作，在新品研制中表现出较高的技术水平，所研制的产品在行业内具有领先地位。曾任烟台东方电子公司研究室副主任、国电南自电网事业部副总经理、烟台正信电气有限公司总经理，现任烟台正信电气有限公司董事长、总经理。
科大智能,300222,苏俊,监事,苏俊先生，中国国籍，未拥有永久境外居留权，1960年7月出生，中国科学技术大学理学士，教授级高级工程师；历任中国科学技术大学地球和空间科学系教师，中国科学技术大学科技实业总公司副总裁、总裁。现担任安徽科大讯飞信息科技股份有限公司董事，中科大资产经营有限责任公司董事、总裁，合肥科大立安安全技术股份有限公司董事长，安徽中科大擎天数码科技有限公司董事长，时代出版传媒股份有限公司董事。
科大智能,300222,陶维青,监事,陶维青先生，中国国籍，未拥有永久境外居留权，1964年3月出生，硕士，副研究员，硕士生导师。主持或参与研发了安徽省“十五二期”科技攻关项目、合肥市高新区科技计划项目等多项科研项目，参与研发的科技成果获安徽省科学技术进步奖二等奖、安徽省科学技术进步奖三等奖等。曾任安徽科大鲁能科技有限公司副总工程师、总工程师，上海科大鲁能集成科技有限公司监事、技术工作委员会副主任。担任合肥工业大学电气与自动化工程学院副研究员。现任上海科大智能科技股份有限公司监事、技术工作委员会副主任。其担任本公司监事的任期为2010年1月28日至2013年1月27日。
科大智能,300222,汪婷婷,监事,"汪婷婷女士,中国国籍,未拥有永久境外居留权,1985年1月出生,硕士。曾任上海科大鲁能集成科技有限公司市场部助理,科大智能科技股份有限公司市场部主管、市场部经理,科大智能电气技术有限公司副总经理,科大智能科技股份有限公司监事。现任科大智能科技股份有限公司副总裁,科大智能电气技术有限公司执行董事兼总经理,科大智能机器人技术有限公司执行董事,江苏宏达电气有限公司执行董事,上海复科智能机器人研究院有限公司董事。"
科大智能,300222,穆峻柏,一般高管,"穆峻柏先生,中国国籍,未拥有永久境外居留权,1979年7月出生,大学本科,中国注册会计师。曾任中国联通安徽分公司报表主管,科大智能科技股份有限公司财务经理,华晓精密工业(苏州)有限公司董事,烟台科大正信电气有限公司董事。现任科大智能科技股份有限公司副总裁、财务总监、董事会秘书,上海冠致工业自动化有限公司董事,烟台正信电气有限公司董事,科大智能物联技术有限公司董事,深圳博建电子科技有限公司监事,捷福装备(武汉)股份有限公司监事,上海复科智能机器人研究院有限公司董事。"
北京君正,300223,刘强,董事长兼高管,"刘强,男,公司董事长、总经理,中国国籍,无境外永久居留权。刘强先生出生于1969年,博士学位。刘强先生自2005年至2009年任北京君正集成电路有限公司董事长,领导研发了嵌入式XburstCPU,现任公司董事长、总经理、深圳君正时代集成电路有限公司执行董事、北京君正集成电路(香港)集团有限公司董事、合肥君正科技有限公司执行董事、北京集成电路产业发展股权投资基金有限公司董事、拉萨君品创业投资有限公司执行董事、经理北京四海君芯有限公司执行董事、经理,合肥君诺志成集成电路投资有限公司执行董事、经理。"
北京君正,300223,冼永辉,董事兼高管,"冼永辉,男,公司董事、副总经理,中国国籍,无境外永久居留权。冼永辉先生出生于1968年,学士学位。冼永辉先生自2005年至2009年任北京君正集成电路有限公司副总经理,现任公司董事、副总经理。冼永辉先生负责公司的系统软硬件工作,是硬件电路、操作系统底层、中间件领域的专家,主持了公司Linux、Android平台及PMP方案和智能手机方案的研发项目。"
北京君正,300223,张紧,董事兼高管,"张紧,男,公司董事、副总经理,中国国籍,无境外永久居留权。张紧先生出生于1962年,硕士学位。张紧先生自2005年至2009年任北京君正集成电路有限公司董事、副总经理、技术总监,现任公司董事、副总经理、合肥君正科技有限公司总经理。张紧先生精通芯片的体系结构、微体系结构和逻辑电路,领导了公司多个嵌入式CPU芯片研发项目。"
北京君正,300223,李杰,董事,"李杰,男,公司董事,中国国籍,无境外永久居留权。李杰先生出生于1963年,硕士学位。李杰先生曾在中科院计算所任职,从事大型机的研制工作,曾任北京庚顿数据科技有限公司执行董事,现任公司董事、北京庚顿数据科技有限公司董事、北京华如科技股份有限公司董事长。"
北京君正,300223,傅代国,独立董事,傅代国，男，出生于1964年，中国国籍，无境外永久居留权，现任西南财经大学会计学院副院长、博士生导师、教授，中国会计学会会员，成都市会计学会副会长，四川省会计人才培养基地负责人。除在本公司担任独立董事之外，傅代国先生同时还担任四川川润股份有限公司、山东龙力生物科技股份有限公司独立董事。傅代国先生与其他持有公司5%以上股份的股东、公司其他现任董事、监事、高级管理人员不存在关联关系，未受过中国证监会及其他有关部门的处罚和证券交易所惩戒，不存在《公司法》、《公司章程》中规定的不得担任公司董事的情形。
北京君正,300223,王芹生,独立董事,"王芹生，女，出生于1942年，中国国籍，无境外永久居留权，毕业于北京航空学院计算机系。王芹生女士先后在中国华大集成电路设计集团有限公司、北京华大电子设计有限责任公司、北京华大信安科技有限公司任职，现任中国半导体行业协会副理事长、中国半导体行业协会集成电路设计分会理事长、上海华申智能卡应用系统有限公司董事长、中国电子学会监事。除在本公司担任独立董事之外，王芹生女士同时还担任江苏银河电子股份有限公司、天水华天科技股份有限公司独立董事。王芹生女士享受政府特殊津贴，是国家""八五""、""九五""、""十五""集成电路CAD技术研究项目的主要负责人，主持了多项国家重点集成电路品种开发和应用项目。"
北京君正,300223,姜君,监事,姜君先生，公司职工代表监事，中国国籍，无境外永久居住权。姜君先生出生于1974年，毕业于清华大学热能系动力工程专业。姜君先生曾在北京百拓立克科技发展有限责任公司、方舟科技（北京）有限公司任职，2005至2009年任君正有限部门经理，现任公司职工代表监事、部门经理。姜君先生精通芯片的体系结构、微体系结构和逻辑电路，主持了公司的CPU内核技术的研发。
北京君正,300223,刘飞,监事,"刘飞,男,公司职工代表监事,中国国籍,无境外永久居住权。刘飞先生出生于1972年,拥有吉林工业大学学士学位。刘飞先生自2005年至2009年任北京君正集成电路有限公司项目经理,现任公司职工代表监事。"
北京君正,300223,许志鹏,监事,"许志鹏,男,公司监事,中国国籍,无境外永久居住权。许志鹏先生出生于1973年,学士学位。许志鹏先生自2005年至2009年任北京君正集成电路有限公司部门经理,现任公司监事、软件架构师。许志鹏先生精通Linux操作系统软件和多媒体软件,领导了公司操作系统底层的研制和多媒体播放器软件的研制。"
北京君正,300223,晏晓京,监事,"晏晓京,女,公司监事会主席,中国国籍,无境外永久居住权。晏晓京女士出生于1965年,拥有电子科技大学学士学位,高级工程师。晏晓京女士自2005年至2009年任北京君正集成电路有限公司部门经理,现任公司监事会主席、部门经理。晏晓京女士对芯片的外围接口电路有丰富的经验,主持设计了闪存接口、UART等多个模块,同时具体负责SOC芯片从规格定义到量产的全过程。
"
北京君正,300223,张敏,一般高管,"张敏,女,公司副总经理、董事会秘书,中国国籍,无境外永久居留权。张敏女士出生于1973年,硕士学位。张敏女士自2007年至2009年任北京君正集成电路有限公司商务总监,现任公司副总经理、董事会秘书、深圳君正时代集成电路有限公司监事、北京君诚易恒科技有限公司监事、拉萨君品创业投资有限公司监事。"
北京君正,300223,张燕祥,一般高管,"张燕祥,女,公司监事会主席,中国国籍,无境外永久居留权。张燕祥女士出生于1968年,学士学位。张燕祥女士自2006年至2009年任北京君正集成电路有限公司财务总监,2009年至2015年任公司副总经理,财务总监,2016年至2018年11月任公司副总经理,现任公司监事会主席。"
北京君正,300223,周生雷,一般高管,"周生雷,男,公司副总经理,中国国籍,无境外永久居留权。周生雷先生出生于1975年,硕士学位。周生雷先生自2008年至2009年任北京君正集成电路有限公司市场总监,现任公司副总经理。"
正海磁材,300224,秘波海,董事长,"秘波海先生:大学学历,高级经济师。1970年9月参加工作,历任山东红旗机械厂技术员、助工,烟台钟表研究所检测研究室副主任,烟台钟表工业公司副经理,烟台木钟厂厂长,烟台电子网板厂筹建处主任、党总支书记,烟台电子网板厂厂长,正海网板党委书记、总经理,正海集团党委书记、董事长、总经理,磁材有限董事长。现任正海集团党委书记、董事长,公司董事长。曾被授予""全国十大优秀青年企业家""、""全国电子工业系统劳动模范""、""山东省劳动模范""、""全国五一劳动奖章""等荣誉。山东省十届、十一届人大代表、烟台市十三届人大代表、山东省第八次党代会代表、烟台市第十次、十一次、十二次党代会代表。秘波海先生通过实际控制的正海集团有限公司间接持有公司30.83%的股份,为公司实际控制人。秘波海先生与持有公司5%以上的股东、实际控制人、公司其他董事、监事、高级管理人员不存在任何关联关系,也不存在《公司法》第147条和《深圳证券交易所创业板上市公司规范运作指引》第3.1.3条所规定的不得担任公司董事的情形。"
正海磁材,300224,王庆凯,董事兼高管,"王庆凯:男,1965年1月出生,工商管理硕士,高级工程师。1985年7月参加工作,历任烟台市电子科研所助理工程师,烟台电子网板厂筹建处工程技术部副主任,正海网板技术部部长、总经理助理,正海网板副总经理兼技术部长,正海集团副总经理,公司副总经理、总经理。现任正海集团董事,公司董事长,正海精密董事长,正海五矿董事、上海大郡董事兼行政总裁、上海郡正董事长、烟台正海磁材有限公司董事长。曾被授予“山东省劳动模范”、“烟台市劳动模范”荣誉称号。"
正海磁材,300224,赵军涛,董事兼高管,"赵军涛:男,1969年11月出生,大学本科学历,高级工程师。1991年7月参加工作,历任正海网板生产部公用工程领班,正海网板工程设计部主管,磁材有限生产技术部部长、总经理助理兼生产技术部部长、副总经理兼总工程师。现任公司董事、常务副总经理,正海五矿董事、上海郡正董事、总经理。"
正海磁材,300224,迟志强,董事,"迟志强:男,1969年11月出生,大学本科学历,中级会计师。1994年7月参加工作,历任正海网板财务部会计、部长助理,磁材有限财务部副部长、部长,正海集团财务部部长、副总会计师。现任正海集团财务总监,正海集团、正海科技、正海电子网板、正海合泰、正海典当董事,公司副董事长。"
正海磁材,300224,曲祝利,董事,"曲祝利先生:大学学历,高级工程师。1970年9月参加工作,历任烟台电子工业科学技术研究所助工,烟台电子工业科学技术研究所副所长,烟台电子网板厂筹建处副主任,烟台电子网板厂副厂长、党总支委员,正海集团董事、常务副总经理,磁材有限董事长。现任正海集团董事、总经理,公司副董事长。曾被授予""烟台市劳动模范""荣誉称号。曲祝利先生通过正海集团有限公司间接持有公司8.41%的股份。曲祝利先生与持有公司5%以上的股东、实际控制人、公司其他董事、监事、高级管理人员不存在任何关联关系,也不存在《公司法》第147条和《深圳证券交易所创业板上市公司规范运作指引》第3.1.3条所规定的不得担任公司董事的情形。"
正海磁材,300224,王宗军,董事,王宗军先生：管理学硕士，经济师。1999年4月参加工作，曾任正海网板财务部部长助理、资本运营部副部长、董事会秘书，董事会办公室主任，正海集团企业发展部部长、董事会办公室主任、总经理助理。现任正海集团战略投资总监。王宗军先生不持有公司股份。王宗军先生与持有公司5%以上的股东、实际控制人、公司其他董事、监事、高级管理人员不存在任何关联关系，也不存在《公司法》第147条和《深圳证券交易所创业板上市公司规范运作指引》第3.1.3条所规定的不得担任公司董事的情形。
正海磁材,300224,金福海,独立董事,金福海先生：北京大学法学硕士，西南政法大学法学博士。现任烟台大学法学院教授、硕士生导师、院长，山东恒邦冶炼股份有限公司、山东中际电工装备股份有限公司、山东瑞康医药股份有限公司及本公司的独立董事。兼任中国法学会经济法学研究会常务理事，山东省法学会国际经济法暨台湾法律问题研究会会长，烟台市人民政府法制咨询专家委员会委员，烟台市、青岛市仲裁委员会仲裁员等。金福海先生未持有烟台正海磁性材料股份有限公司股份。金福海先生未受过中国证监会及其他有关部门的处罚和证券交易所惩戒，不存在《深圳证券交易所创业板上市公司规范运作指引》第3.1.3条所规定的禁止担任公司董事、监事、高级管理人员的情形。金福海先生与持有烟台正海磁性材料股份有限公司5%以上股东，实际控制人，其他董事、监事候选人不存在关联关系。
正海磁材,300224,严纯华,独立董事,"严纯华先生：北京大学理学博士，中国工程院院士。现任北京大学稀土材料化学及应用国家重点实验室教授、实验室主任，""无机化学""长江特聘教授、香港中文大学化学系荣誉教授、《J.RareEarths》杂志执行主编、《材料研究通报》主编、材料化学（ACS）委员会委员。严纯华先生未持有烟台正海磁性材料股份有限公司股份。严纯华先生未受过中国证监会及其他有关部门的处罚和证券交易所惩戒，不存在《深圳证券交易所创业板上市公司规范运作指引》第3.1.3条所规定的禁止担任公司董事、监事、高级管理人员的情形。严纯华先生与持有烟台正海磁性材料股份有限公司5%以上股东，实际控制人，其他董事、监事候选人不存在关联关系。"
正海磁材,300224,于希茂,独立董事,"于希茂先生:工商管理硕士,高级审计师,中国注册会计师,山东省注册会计师协会常务理事。曾任职于山东省地矿局第三地质队、烟台市审计局、烟台市审计师事务所、山东华茂会计师事务所。现任职于山东正源和信会计师事务所,公司独立董事。于希茂先生未持有烟台正海磁性材料股份有限公司股份。于希茂先生未受过中国证监会及其他有关部门的处罚和证券交易所惩戒,不存在《深圳证券交易所创业板上市公司规范运作指引》第3.1.3条所规定的禁止担任公司董事、监事、高级管理人员的情形。于希茂先生与持有烟台正海磁性材料股份有限公司5%以上股东,实际控制人,其他董事、监事候选人不存在关联关系。
"
正海磁材,300224,梁靓,监事,"梁靓:1985年生,大学本科学历,助理经济师。2007年8月参加工作,历任烟台正海磁性材料有限公司人力资源专员。现任公司人力资源部资深主管。截止公告日,梁靓女士未持有公司股票,与持有公司5%以上股份的股东、实际控制人、公司其他董事、监事、高级管理人员不存在任何关联关系,也不存在《深圳证券交易所创业板上市公司规范运作指引》(2015年修订)第3.2.3条所规定的禁止担任公司董事、监事、高级管理人员的情形,符合《公司法》等相关法律、法规和规定要求的任职条件,未受过中国证监会及其他有关部门的处罚或证券交易所惩戒。"
正海磁材,300224,全杰,监事,"全杰先生:男,1977年12月出生,中国国籍,无海外居留权,企业管理硕士,高级经济师。曾任正海网板职员,正海集团人力资源部职员、部长助理,磁材有限人力资源部副部长、部长,综合管理部部长,正海集团人力资源部副部长、部长、公司监事。现任正海集团党委副书记、工会主席,正海实业董事长,正海集团监事会主席,正海典当、正海磁材监事。"
正海磁材,300224,许月莉,监事,"许月莉:女,1974年1月出生,大学本科学历,中国注册会计师。曾任山东乾聚有限责任会计师事务所审计项目经理、正海集团总经理助理、审计部部长。现任正海集团审计总监兼审计部部长,正海科技、正海合泰、正海生物、正海典当、正海磁材监事会主席,正海集团、正海电子网板、正海置业、正海实业、正海投资监事。"
正海磁材,300224,高波,一般高管,"高波:女,1975年8月出生,大学本科学历,高级会计师,中国注册会计师。1998年7月参加工作,历任山东正源和信会计师事务所审计部项目经理、正海集团审计监管部审计主管、正海实业财务部部长、磁材有限财务负责人。现任公司财务总监、上海大郡监事会主席、正海五矿监事会主席、上海郡正监事、烟台正海磁材有限公司监事。"
