神州泰岳,300002,王宁,董事长,"王宁先生,1961年出生,中国国籍,无永久境外居留权。毕业于河北大学,理学、法学双学士,荣获2006年“中国软件企业十大领军人物”、2009年“中国软件产业发展功勋人物”及“中国软件产业杰出企业家”。曾任河北大学校团委书记、河北大学出版社社长、联想集团工控公司电脑部经理、北京新海拓科技公司总经理,北京神州泰岳科技有限公司副总经理、总经理。2001年5月至今担任神州泰岳公司董事长,其中,2001年5月至2007年7月,曾任公司财务负责人、总经理。兼任北京启天同信科技有限公司董事、北京神州良品电子商务科技股份有限公司董事长、北京华泰德丰技术有限公司董事长、北京创董创新实业有限公司董事长、北京善聚投资管理有限公司执行董事。持有公司股份126,958,612股,为公司控股股东及实际控制人,未受过中国证监会及其他有关部门的处罚和证券交易所惩戒,不存在《创业板上市公司规范运作指引》第3.2.3条所规定的情形。"
神州泰岳,300002,翟一兵,董事兼高管,"翟一兵先生,1963年7月出生,中国国籍,无永久境外居留权,教授级高级工程师。1986年毕业于北京邮电学院无线电工程专业,同年留校任计算机工程系助教;先后获得挪威商学院硕士学位和法国雷恩商学院博士学位。曾在邮电部电信总局工作,任科员、主任、局长助理;在地方挂职锻炼任职副市长;中国移动通信集团公司筹备办公室主任、网络部副部长;在中国联合通信有限公司工作期间曾任移动部、增值业务部、营销部副总经理、联通时科信息技术有限公司董事、首席执行官(CEO);2013年3月,担任神州泰岳公司首席运营官(COO)。2013年5月至今担任公司董事兼首席运营官。持有公司股票1,802,002股,与其他持有公司5%以上股份的股东、实际控制人、其他董事、监事、高级管理人员不存在关联关系,未受过中国证监会及其他有关部门的处罚和证券交易所惩戒,不存在《创业板上市公司规范运作指引》第3.2.3条所规定的情形。"
神州泰岳,300002,黄松浪,董事兼高管,"黄松浪先生毕业于清华大学，软件工程硕士学位，2002年获美国新泽西州立大学Rutgers商学院EMBA学位；曾任吉通通信有限公司技术总体部经理、中国惠普有限公司软件业务部总经理、上海联盈数码技术有限公司董事、总经理；2007年7月至今任公司副董事长、董事会秘书。兼任上海联盈数码技术有限公司董事。持有公司股份19,360,230股，与其他持有公司5%以上股份的股东、实际控制人、其他董事、监事、高级管理人员不存在关联关系，未受过中国证监会及其他有关部门的处罚和证券交易所惩戒，不存在《深圳证券交易所创业板股票上市规则》第3.2.4条所规定的不得担任上市公司董事会秘书的情形。已通过深圳证券交易所创业板董事会秘书资格考试。"
神州泰岳,300002,李力,董事兼高管,"李力先生,1971年出生,中国国籍,新加坡永久居留权。毕业于首都经贸大学,曾任北京力霸科技有限公司副总经理。李力先生作为主要创始人,历任神州泰岳公司董事、常务副总经理、总经理。兼任北京启天同信科技有限公司董事、神州泰岳(香港)有限公司董事、中建智能技术有限公司董事。截止目前,持有公司股份215,954,004股,为公司控股股东及实际控制人,未受过中国证监会及其他有关部门的处罚和证券交易所惩戒,不存在《创业板上市公司规范运作指引》第3.2.3条所规定的情形。"
神州泰岳,300002,万能,董事兼高管,"万能先生，男，1971年出生，毕业于北京科技大学；曾任北京科海天地电子技术有限公司技术部经理、北京中自公司技术部经理、北京神州泰岳科技有限公司副经理；2001年5月至今任公司董事，自2007年7月起担任公司财务总监。兼任北京启天同信科技有限公司董事。持有公司股份15,488,180股，与其他持有公司5%以上股份的股东、实际控制人、其他董事、监事、高级管理人员不存在关联关系，未受过中国证监会及其他有关部门的处罚和证券交易所惩戒，不存在《创业板上市公司规范运作指引》第3.1.3条所规定的情形。"
神州泰岳,300002,汪铖,董事兼高管,"汪铖先生,男,1974年1月出生,毕业于武汉测绘科技大学,学士学位。曾任兆维集团通信工程师、联想集团销售经理,北京互联时代通讯科技有限公司总经理,2007年起至今任北京新媒传信科技有限公司执行董事、总经理。持有公司股份10,257,860股,与其他持有公司5%以上股份的股东、实际控制人、其他董事、监事、高级管理人员不存在关联关系,未受过中国证监会及其他有关部门的处罚和证券交易所惩戒,不存在《创业板上市公司规范运作指引》第3.1.3条所规定的情形。
"
神州泰岳,300002,齐强,董事,"齐强先生，1970年出生，毕业于河北大学；曾任北京科海天地电子技术有限公司销售部经理、北京中自公司销售部经理；1997年至今历任北京神州泰岳科技有限公司副经理、北京启天同信科技有限公司总经理；2001年5月至今任公司董事，兼任北京启天同信科技有限公司董事长、总经理。持有公司股份23,062,825股，与其他持有公司5%以上股份的股东、实际控制人、其他董事、监事、高级管理人员不存在关联关系，未受过中国证监会及其他有关部门的处罚和证券交易所惩戒，不存在《创业板上市公司规范运作指引》第3.1.3条所规定的情形。"
神州泰岳,300002,徐斯平,董事,"徐斯平先生，1958年出生，毕业于大连理工大学；曾先后任职于国家计委、国家经贸委、香港江胜集团、北京思乐信息技术有限公司；2005年6月至今任公司董事。兼任北京思乐信息技术有限公司董事长。持有公司股份12,955,200股，与其他持有公司5%以上股份的股东、实际控制人、其他董事、监事、高级管理人员不存在关联关系，未受过中国证监会及其他有关部门的处罚和证券交易所惩戒，不存在《创业板上市公司规范运作指引》第3.1.3条所规定的情形。"
神州泰岳,300002,江锡如,独立董事,江锡如先生，男，1965年2月出生，毕业于中国人民大学，获经济学学士学位，高级会计师，党员。曾任财政部办公厅秘书；财政部原商贸司副处长；财政部经贸司及企业司副处长；财政部企业司正处级调研员；中投信用担保有限公司财务总监兼财务部总经理。现任中国华粮物流集团公司总经理助理；兼任中国华粮物流集团北良有限公司副总经理兼财务总监；北京东方园林股份有限公司独立董事；上海凌云实业发展股份有限公司独立董事；北京顺鑫农业股份有限公司独立董事。未持有公司股份，与持有公司5%以上股份的股东、实际控制人、其他董事、监事、高级管理人员不存在关联关系，未受过中国证监会及其他有关部门的处罚和证券交易所惩戒，不存在《创业板上市公司规范运作指引》第3.1.3条所规定的情形。
神州泰岳,300002,蓝伯雄,独立董事,蓝伯雄，男，中国国籍，教授。1993年毕业于加拿大滑铁卢大学管理科学系，获管理科学博士学位。曾任清华大学经济管理学院副院长；现任清华大学经济管理学院教授，兼任中国电子学会工业工程分会副主任委员、中国运筹学会常务理事、北京运筹学会副理事长、中国中小企业对外交流与合作协会理事、北京华胜天成科技股份有限公司独立董事。未持有公司股份，与持有公司5%以上股份的股东、实际控制人、其他董事、监事、高级管理人员不存在关联关系，未受过中国证监会及其他有关部门的处罚和证券交易所惩戒，不存在《创业板上市公司规范运作指引》第3.1.3条所规定的情形。
神州泰岳,300002,刘凯湘,独立董事,"刘凯湘，男，中国国籍，博士学历，教授，仲裁员。1987年7月至1999年5月任北京工商大学教授，1999年5月至今任北京大学教授、博士生导师。
兼任中国国际经济贸易仲裁委员会仲裁员，新加坡国际仲裁院仲裁员，北京仲裁委员会仲裁员，中国法学会民法研究会常务理事，北京市民商法研究会常务理事，湖南大学、上海大学、北京工商大学、澳门科技大学等兼职教授；国家统计局、河北省人大常委会等专家咨询委员会委员；太极计算机股份有限公司独立董事。
未持有公司股份，与持有公司5%以上股份的股东、实际控制人、其他董事、监事、高级管理人员不存在关联关系，未受过中国证监会及其他有关部门的处罚和证券交易所惩戒，不存在《创业板上市公司规范运作指引》第3.1.3条所规定的情形。"
神州泰岳,300002,罗建北,独立董事,"罗建北女士,1945年11月出生,中国国籍,无永久境外居留权,本科学历、研究员。1970年至1994年3月任清华大学计算机系党委书记、副教授;1994年4月至1996年12月任清华大学软件技术中心主任;1997年1月至1999年2月任清华同方股份有限公司董事、常务副总裁;1999年3月至2009年3月任清华科技园副主任、启迪控股股份有限公司副总裁;2009年4月正式退休。2014年6月至今担任公司独立董事。兼任双清诚德科技(北京)有限公司董事、苏州清桥电子科技有限公司董事。未持有公司股份,与持有公司5%以上股份的股东、实际控制人、其他董事、监事、高级管理人员不存在关联关系,未受过中国证监会及其他有关部门的处罚和证券交易所惩戒,不存在《创业板上市公司规范运作指引》第3.2.3条所规定的情形。"
神州泰岳,300002,丁彦超,监事,"丁彦超先生,1968年出生,中国国籍,无永久境外居留权。毕业于西北大学计算机系;曾任天津石化公司计算机中心软件工程师,2002年至今历任公司研发工程师、网管项目管理部技术主管、项目管理部技术主管,现任公司经营支撑中心运营部经理。持有公司股份401,335股,与持有公司5%以上股份的股东、实际控制人、其他董事、监事、高级管理人员不存在关联关系,未受过中国证监会及其他有关部门的处罚和证券交易所惩戒,不存在《创业板上市公司规范运作指引》第3.2.3条所规定的情形。"
神州泰岳,300002,郝岩,监事,"郝岩女士,1980年出生,中国国籍,无永久境外居留权。毕业于北京林业大学;2004年8月至今历任公司行政部经理助理、经理。2008年11月起任公司职工监事。持有公司股份400股,与持有公司5%以上股份的股东、实际控制人、其他董事、监事、高级管理人员不存在关联关系,未受过中国证监会及其他有关部门的处罚和证券交易所惩戒,不存在《创业板上市公司规范运作指引》第3.2.3条所规定的情形。"
神州泰岳,300002,李广刚,监事,李广刚先生，1978年出生，毕业于济南大学；曾任北京泰立特科技发展有限公司青岛分公司软件工程师、北京新晨科技股份有限公司客户经理、联盈数码公司客户经理；2005年12月至今任公司销售经理、监事会主席。未持有公司股份，与持有公司5%以上股份的股东、实际控制人、其他董事、监事、高级管理人员不存在关联关系，未受过中国证监会及其他有关部门的处罚和证券交易所惩戒，不存在《创业板上市公司规范运作指引》第3.1.3条所规定的情形。
神州泰岳,300002,高峰,一般高管,"高峰先生,1976年出生,中国国籍,无永久境外居留权。毕业于沈阳航空工业学院;2002年至今历任公司销售经理、高级销售经理、行业销售总监、副总裁。现兼任北京神州泰岳信息安全技术有限公司总经理、新疆神州泰岳智能科技有限公司执行董事。目前,持有公司股票9,675,886股,与其他持有公司5%以上股份的股东、实际控制人、其他董事、监事、高级管理人员不存在关联关系,未受过中国证监会及其他有关部门的处罚和证券交易所惩戒,不存在《创业板上市公司规范运作指引》第3.2.3条所规定的情形。"
神州泰岳,300002,刘豪,一般高管,"刘豪先生，男，1972年出生，毕业于西安理工大学；曾任金科集团公司金融行业销售经理、中国惠普有限公司软件业务部销售经理、国际商业机器（中国）有限公司软件部Tivoli北方区销售经理；2007年至今担任公司副总经理。持有公司股份150,000股，与其他持有公司5%以上股份的股东、实际控制人、其他董事、监事、高级管理人员不存在关联关系，未受过中国证监会及其他有关部门的处罚和证券交易所惩戒，不存在《创业板上市公司规范运作指引》第3.1.3条所规定的情形。"
神州泰岳,300002,孙海粟,一般高管,孙海粟先生，1965年2月出生，毕业于北京邮电大学无线电工程专业，学士学位。曾任国家计生委北京宣教中心工作干部、宁波燕浩微波通信公司开发部经理，宁波江北通信设备实业公司总经理，宁波未来通信技术有限公司总经理，2001年起至今任宁波普天通信技术有限公司总经理。孙海粟先生均不存在下列情形：1、最近三年内收到中国证监会行政处罚；2、最近三年内受到证券交易所公开谴责或三次以上通报批评；3、被中国证监会宣布为市场禁入者且尚在禁入期；4、被证券交易所公开认定为不适合担任上市公司高级管理人员；5、无法确保在任职期间投入足够的时间和精力于公司事务，切实履行高级管理人员应履行的各项职责。6、与持有公司5%以上股份的股东、实际控制人、公司其他董事、监事、高级管理人员不存在关联关系。
神州泰岳,300002,陶磊,一般高管,"陶磊先生，男，1972年6月出生，毕业于南京理工大学，工学学士学位。曾任中国兵器工业总公司干部，北京新宇计算机有限公司、英国电信Syntegra销售经理，上海联盈数码技术有限公司销售总监。2005年11月至今先后担任北京神州泰岳软件股份有限公司大客户经理、总经理助理。持有公司股份375,000股，与其他持有公司5%以上股份的股东、实际控制人、其他董事、监事、高级管理人员不存在关联关系，未受过中国证监会及其他有关部门的处罚和证券交易所惩戒，不存在《创业板上市公司规范运作指引》第3.1.3条所规定的情形。"
神州泰岳,300002,许芃,一般高管,"许芃先生，男，1973年出生，毕业于北京邮电大学；曾任秦皇岛电信局职员、中联集团工程师、CA公司工程师；2002年至今历任公司系统网络事业部总经理、公司副总经理。持有公司股份3,533,235股，与其他持有公司5%以上股份的股东、实际控制人、其他董事、监事、高级管理人员不存在关联关系，未受过中国证监会及其他有关部门的处罚和证券交易所惩戒，不存在《创业板上市公司规范运作指引》第3.1.3条所规定的情形。"
神州泰岳,300002,张振鹏,一般高管,"张振鹏先生，男，1961年出生，毕业于北京邮电学院，高级工程师；曾任石家庄邮电高等专科学校团委书记、学生处处长、成教部主任、培训部主任等职；2003年至今担任公司副总经理。持有公司股份2,473,265股，与其他持有公司5%以上股份的股东、实际控制人、其他董事、监事、高级管理人员不存在关联关系，未受过中国证监会及其他有关部门的处罚和证券交易所惩戒，不存在《创业板上市公司规范运作指引》第3.1.3条所规定的情形。"
神州泰岳,300002,朱健松,一般高管,"朱健松先生，男，1967年4月出生，毕业于北京联合大学电子工程学院，工学学士学位。曾任中国仪器进出口总公司职员、副科长；英孚美软件（中国）有限公司高级客户经理、销售经理；北邮电信科技股份有限公司北邮集思公司总经理、北邮电信资源管理事业部总经理；博思软件（中国）有限公司销售经理、销售总监、中国区业务总经理等职务。2008年加入北京神州泰岳软件股份有限公司任电信销售部总经理。持有公司股份375,000股，与其他持有公司5%以上股份的股东、实际控制人、其他董事、监事、高级管理人员不存在关联关系，未受过中国证监会及其他有关部门的处罚和证券交易所惩戒，不存在《创业板上市公司规范运作指引》第3.1.3条所规定的情形。"
乐普医疗,300003,蒲忠杰,董事长兼高管,"蒲忠杰先生:1963年出生,中国国籍,拥有美国永久居留权,研究生学历、博士学位。曾任北京钢铁研究总院高级工程师,美国佛罗里达国际大学研究助理,美国WP医疗科技公司技术副总经理;现任乐普(北京)医疗器械股份有限公司董事长、总经理、技术总监,乐普生物科技有限公司执行董事、总经理,北京金一文化发展股份有限公司独立董事,兼任国家心脏病植介入诊疗器械及设备工程技术研究中心主任、中国生物材料学会副会长、北京医药行业协会副会长、中国药品监督管理研究会常务理事、全国卫生产业企业管理协会副会长、中关村昌平大健康联盟理事长、中国生物工程学会理事。"
乐普医疗,300003,李国强,董事,"李国强先生,本公司监事会主席,1955年出生,中国国籍,无境外永久居留权,大学本科学历,研究员级高级工程师。历任中国船舶工业总公司副处长、处长,深圳远舟科技实业有限公司董事兼总经理(副局长级)、副董事长,中船重工科技投资发展有限公司董事兼总经理、副总经理,乐普(北京)医疗器械股份有限公司董事兼董事会秘书、董事,中船重工科技投资发展有限公司副总经理。现任亚光科技集团股份有限公司独立董事,北京当升材料科技股份有限公司独立董事、中工国际工程股份有限公司独立董事。"
乐普医疗,300003,马玉璞,董事,"马玉璞先生,本公司副董事长,1962年出生,中国国籍,无境外永久居留权,研究生学历,硕士学位,研究员。历任中国船舶重工集团公司第七二五研究所研究室副主任、副总工程师、总工程师、党委书记兼副所长、所长。曾获国务院特殊津贴,全国劳动模范,中国船舶工业总公司优秀中青年专家,第十二届、十三届全国人大代表。现任中国船舶重工集团公司第七二五研究所科技委主任。"
乐普医疗,300003,徐扬,董事,"徐扬先生:1967年出生,中国国籍,无境外永久居留权,研究生学历,执业律师。曾任中信律师事务所律师,公诚律师事务所律师,天达律师事务所律师,北京市四海通程律师事务所律师,北京七星华创电子科技股份有限公司独立董事、中外运空运发展股份有限公司独立董事;现任北京重光律师事务所高级合伙人、律师,乐普(北京)医疗器械股份有限公司第四届董事会董事。"
乐普医疗,300003,陈磊,独立董事,"陈磊先生,本公司独立董事,1970年出生,中国国籍,无境外永久居留权,研究生学历,硕士学位。历任中央民族出版社会计,中信会计师事务所部门经理,中兴宇会计师事务所部门经理,北京网商世界电子技术有限公司财务总监,豪力海文科技发展有限公司副总经理,北京海问咨询有限公司咨询顾问,北京世纪东方国铁电讯科技有限公司财务总监,北京紫檀国际教育咨询有限公司总经理,天壕节能科技股份有限公司财务总监。现任北京龙腾佳讯科技股份有限公司董事。"
乐普医疗,300003,付立家,独立董事,"付立家先生,本公司独立董事,1963年出生,中国国籍,无境外永久居留权,研究生学历,硕士学位。历任北京机电研究院干部,中国康华公司干部,北京第一通用机械厂计算机室主任。现任北京亚东生物制药有限公司总经理。"
乐普医疗,300003,徐猛,独立董事,"徐猛先生,本公司独立董事,1968年出生,中国国籍,无境外永久居留权,研究生学历,硕士学位。历任中国船舶工业总公司监察局、办公厅干部,北京劳赛德律师事务所、北京赛德天勤律师事务所合伙人、主任、党支部书记,北京市律师协会第八届理事。现任北京万商天勤律师事务所合伙人。"
乐普医疗,300003,陈倩,监事,"陈倩女士:1978年9月出生,中国国籍,无境外永久居留权,研究生学历、硕士学位。2007年7月加入公司,曾任公司人力资源部副经理、采购部经理,现任公司同心管家项目经理、工会主席、公司第三届监事会职工监事。
"
乐普医疗,300003,王社教,监事,"王社教先生,本公司独立董事,男,1966年出生,中国国籍,无境外永久居留权,研究生学历,硕士学位。历任冶金工业部自动化院传动所财务科副科长、计划财务部常务副主任兼财务科科长,北京蔼依根（AEG）电器传动有限公司财务经理,北京金自天正智能控制股份有限公司金融部副部长兼会计室主任、部长、监事、监事会主席,冶金自动化院研究设计院副总会计师兼财务经济部主任、总会计师。现任中国钢研科技集团副总会计师兼冶金自动化研究设计院总会计师。"
乐普医疗,300003,周全,监事,"周全先生:男,1956年出生,中国国籍,无境外永久居留权,本科学历,学士学位,高级工程师。历任中国船舶工业总公司第四○七厂技术员、产品设计研究所党支部副书记、组织部长、厂长助理兼柴油机事业部主任、副厂长、厂长,中国船舶重工集团公司河南柴油机集团有限公司董事长、总经理,第七二五研究所纪委书记、总法律顾问。现任中国船舶重工集团公司第七二五研究所纪委书记兼工会主席。曾获国防科技工业511高级管理人才、省国防科技工业系统劳动模范和优秀经营管理者等荣誉称号。周全先生未持有公司股份,是公司实际控制人、控股股东员工,与其他持有公司5%以上股份的股东、其他董事、监事、高级管理人员不存在关联关系,未受过中国证监会及其他有关部门的处罚和证券交易所惩戒,不存在《深圳证券交易所创业板上市公司规范运作指引》第3.1.3条所规定的情形。
"
乐普医疗,300003,王泳,一般高管,"王泳女士:1973年出生,中国国籍,无境外永久居留权,本科学历,学士学位。曾任普华永道中天会计师事务所北京分所审计部高级经理;现任乐普(北京)医疗器械股份有限公司副总经理、财务总监,乐普生物科技有限公司监事,四川睿健医疗科技股份有限公司监事。"
乐普医疗,300003,魏战江,一般高管,"魏战江先生:1972年出生,中国国籍,无境外永久居留权,研究生学历,硕士学位,研究员级高级工程师。曾任职于中国船舶重工集团公司第七二五研究所;现任乐普(北京)医疗器械股份有限公司副总经理,中国共产党北京市第十二次代表大会代表。"
乐普医疗,300003,张霞,一般高管,"张霞女士:1968年出生,中国国籍,无境外永久居留权,研究生学历,硕士学位,研究员级高级工程师。曾任中国船舶重工集团第七二五研究所非金属材料研究室副主任,科技处处长、副总工程师;现任乐普(北京)医疗器械股份有限公司副总经理,中美华世通生物医药科技(武汉)有限公司董事,隆华科技集团(洛阳)股份有限公司独立董事,河南省第十三届人大代表。"
汉威科技,300007,任红军,董事长,"任红军,男,1967年出生,中国国籍,EMBA,高级工程师,历任郑州晶体管厂技术员、工程师,郑州汽车客运总公司下属科达电子厂高级工程师、副厂长,自1998年创立公司前身河南汉威电子有限公司以来一直在汉威科技任职。现为公司第五届董事会董事长。"
汉威科技,300007,焦桂东,董事兼高管,"焦桂东,男,1972年出生,大学专科学历。曾任职于广东东莞励扬集团横江电子厂、浙江庄吉集团郑州分公司、郑州三华科技实业有限公司,2004年5月起就职于汉威有限,现任公司副总经理。焦桂东先生的董事任职由股东提名,经公司2008年1月18日召开的创立大会选举产生,任期至2011年1月17日。
"
汉威科技,300007,徐克,董事兼高管,徐克，1965年出生，MBA，现任职公司常务副总经理。徐克先生与其他持有公司5%以上股份的股东、实际控制人及其他董事、监事、高级管理人员不存在关联关系，未受过中国证监会及其他有关部门的处罚和证券交易所惩戒，不存在《深圳证券交易所创业板上市公司规范运作指引》第3.1.3条所规定的情形。
