顺网科技,300113,李德宏,一般高管,"李德宏,男,中国国籍,无境外永久居留权,1968年出生,毕业于浙江大学,获经济学硕士学位,香港中文大学在职会计学硕士,注册会计师。2009年12月加入公司,现任公司副总经理、财务总监。"
顺网科技,300113,吴晓伟,一般高管,"吴晓伟,男,1955年3月出生,中国国籍,研究生学历,高级工程师。吴晓伟先生2006年-2010年任中国电信股份有限公司浙江省公司副总经理;2010年-2013年中国通信服务股份有限公司浙江省公司总经理。
截止公告日,吴晓伟先生未持有上市公司股份;与其他持有公司5%以上股份的股东、董事、监事和高级管理人员不存在关联关系;从未受过中国证监会及其他有关部门的处罚和证券交易所惩戒,也不存在《深圳证券交易所创业板上市公司规范运作指引》第3.1.3条所规定的情形。
"
顺网科技,300113,徐钧,一般高管,"徐钧,男,1975年12月4日出生,中国国籍,无境外居留权,毕业于浙江大学。1998-2004年,浙江大学工作;2006年-2018年杭州顺网科技股份有限公司:产品经理、副总、董秘;2018-2019浙江诺特健康科技股份有限公司:IT总监。2019年-至今:杭州顺网科技股份有限公司:董事、首席战略官。"
顺网科技,300113,张丽,一般高管,"张丽,女,中国国籍,毕业于清华大学,2009年—2012年普华永道中天会计师事务所;2012年—2014年国泰君安证券并购融资部;2014年4月加入公司,现任公司副总经理、董事会秘书、投资总监
"
顺网科技,300113,郑巧玲,一般高管,"郑巧玲，女，1971年出生，中国国籍，毕业于浙江财经学院，会计师，中国注册会计师。郑巧玲女士1994-2000年任职于浙江省包装公司、浙江包装集团有限公司投资管理部、财务部；2001-2002任杭州康尔数码设备有限公司财务经理；2003-2010年任职南华发展集团有限公司，先后担任财务部副经理、财务部经理、财务总监；2010年8月加入公司任审计部经理。
郑巧玲女士系本公司的员工，与上市公司或其控股股东及实际控制人无存在关联关系;与持有公司百分之五以上股份的股东、实际控制人之间无存在关系,最近五年没有在其他机构担任董事、监事、高级管理人员；未受过证券监管部门的处罚和证券交易所惩戒。"
中航电测,300114,康学军,董事长,"康学军先生,1964年9月生,商管理硕士,研究员级高级工程师,历任中原电测仪器厂技术科设计员、技术引进办公室主管技术员、应变计车间主管技术员、技术室主任、应变计车间副主任、主任、应变计分厂厂长、工厂副总工程师、副厂长、公司副总经理、总经理、汉航集团副总经理。现任本公司党委书记、公司第六届董事会董事长。"
中航电测,300114,刘东平,董事兼高管,"刘东平,男,中国国籍,无境外居留权,1964年8月出生,硕士研究生学历,高级工程师,历任中原电测仪器厂52车间技术员、技术室主任,技术科主管、技术室主任,销售科销售员、室主任,52分厂副厂长、厂长,中航电测52分厂厂长、总经理助理、传感器事业部部长兼经营计划部部长、副总经理。现任本公司党委副书记、总经理、公司第六届董事会董事。"
中航电测,300114,李宝龙,董事,"李宝龙,男,中国国籍,无境外居留权,1964年8月出生,本科学历,研究员级高级经济师。先后毕业于西北工业大学、华中科技大学。曾先后担任中航工业洪都集团有限责任公司物资供应部副部长、部长、副总工程师、中航工业洪都集团有限责任公司资深经理兼战略投资管理委员会常务副主任,现任江西洪都航空工业股份有限公司副总经理、公司第六届董事会董事。"
中航电测,300114,罗宝军,董事,罗宝军，男，中国国籍，无境外居留权，1957年1月出生，大学学历，研究员级高级政工师，历任012基地生产计划处计划员、团委副书记、团委书记兼工会副主席、工会主席兼团委书记、党委副书记兼纪委书记和工会主席、汉航集团党委副书记兼纪委书记和工会主席、董事。现任汉航集团董事长、总经理、党委书记、汉中航空物资有限责任公司董事长，本公司第三届董事会董事。罗宝军先生未持有本公司股票，不存在《公司章程》第九十三条规定不得担任董事的情形，从未受过中国证监会及其他有关部门的处罚和证券交易所惩戒，也不存在《深圳证券交易所创业板上市公司规范运作指引》第3.1.3条所规定的情形；与其他持有公司5%以上股份的股东、实际控制人存在关联关系，与公司其他董事、监事和高级管理人员不存在关联关系。
中航电测,300114,夏保琪,董事,"夏保琪,男,中国国籍,无境外居留权,1964年11月出生,硕士研究生学历,一级高级经济师。曾先后担任南京金城机械有限公司整车工厂生产计划处处长、南京金城机械有限公司管理处处长、副总经济师、金城集团摩托车销售有限公司副总经理、金城集团有限公司规划管理部副部长、资本运营部部长、中航黑豹股份有限公司副总经理兼董事会秘书,现任中航工业机电系统股份有限公司董事会秘书、本公司第六届董事会董事。"
中航电测,300114,赵国庆,董事,"赵国庆,男,中国国籍,无境外居留权,1968年7月出生,硕士研究生学历,高级工程师,历任012基地航空工业贸易公司业务员,苏州吴县天达电子传感测控仪器厂设计员,012基地天达航空工业总公司进出口公司业务员,深圳凯卓立液压设备有限公司经理部经理,天达航空工业总公司团委副书记、党群部组织干事,汉航集团党政办副主任、主任,千山电子仪器厂副厂长、党委副书记,中航电测党委书记、党委书记兼监事会主席。现任汉中一零一执行董事、本公司副总经理。"
中航电测,300114,刘学军,独立董事,刘学军，男，中国国籍，无境外居留权，1969年8月出生，本科学历，历任天津日电电子通信工业有限公司人力资源经理、益普生（中国）制药有限公司综合事务总监。现任上海佐佑企业管理咨询有限责任公司高级合伙人、本公司第三届董事会独立董事。刘学军先生未持有公司股份，不存在《公司章程》第九十三条规定不得担任董事的情形，从未受过中国证监会及其他有关部门的处罚和证券交易所惩戒，也不存在《深圳证券交易所创业板上市公司规范运作指引》第3.1.3条所规定的情形；与其他持有公司5%以上股份的股东、实际控制人、公司董事、监事和高级管理人员不存在关联关系。
中航电测,300114,田高良,独立董事,田高良先生，男，中国国籍，无境外居留权，1965年1月出生，西安交通大学会计专业博士、博士生导师，中国人民大学工商管理博士后，副教授，1996年至2000年在陕西财经学院任讲师，2000年至今在西安交通大学任教，现任西安交通大学管理学院会计与财务系主任，陕西会计学会理事、陕西省天然气股份有限公司独立董事等职。田高良先生未持有公司股份，不存在《公司章程》第九十三条规定不得担任董事的情形，从未受过中国证监会及其他有关部门的处罚和证券交易所惩戒，也不存在《深圳证券交易所创业板上市公司规范运作指引》第3.1.3条所规定的情形；与其他持有公司5%以上股份的股东、实际控制人、公司董事、监事和高级管理人员不存在关联关系。
中航电测,300114,赵惠英,独立董事,"赵惠英,男,中国国籍,无境外居留权,1959年7月出生,博士研究生学历,教授、博士生导师。一直从事精密超精密加工、测量设备主机和单元部件的设计、研制及工艺试验等科研工作。现任西安交通大学教授,博士生导师,本公司第六届董事会独立董事。"
中航电测,300114,赵祥模,独立董事,赵祥模，男，中国国籍，无境外居留权，1966年8月出生，博士研究生学历，教授、博士生导师。一直在长安大学从事交通信息工程与计算机应用技术领域的教学和科研工作。现任长安大学校长助理，长安大学计算机应用研究所所长，国务院学位委员会交通运输工程学科评议组成员，中国交通运输协会信息专业委员会理事、咨询专家组成员，陕西省公路学会计算机应用专业委员会副主任委员，陕西省计算机学会常务理事，陕西省计算机教育学会常务理事，长安大学学术委员会、学位委员会委员，《长安大学学报》编委，《现代电子技术》编委，《电子设计工程》编委，本公司第三届董事独立董事。赵祥模先生未持有公司股份，不存在《公司章程》第九十三条规定不得担任董事的情形，从未受过中国证监会及其他有关部门的处罚和证券交易所惩戒，也不存在《深圳证券交易所创业板上市公司规范运作指引》第3.1.3条所规定的情形；与其他持有公司5%以上股份的股东、实际控制人、公司董事、监事和高级管理人员不存在关联关系。
中航电测,300114,陈栋梁,监事,陈栋梁，男，中国国籍，无境外居留权，1965年10月出生，本科学历，高级会计师。历任中航供销汉中公司财务科科员、副科长、科长（经理）、副总会计师，汉航集团财务部副部长、人力资源部部长、财务审计部部长。现任中航工业长空精密机械制造公司总会计师，兼任陕西华燕航空仪表有限公司、陕西千山航空电子有限责任公司监事，本公司第三届监事会监事。陈栋梁先生未持有本公司股票，不存在《公司章程》第一百三十五条规定不得担任监事的情形，从未受过中国证监会及其他有关部门的处罚和证券交易所惩戒，也不存在《深圳证券交易所创业板上市公司规范运作指引》第3.1.3条所规定的情形；与其他持有公司5%以上股份的股东、实际控制人存在关联关系，与公司其他董事、监事和高级管理人员不存在关联关系。
中航电测,300114,郭廷仁,监事,郭廷仁，男，中国国籍，无境外居留权，1956年12月出生，硕士研究生学历，研究员级高经师。曾先后担任西安航空发动机公司工艺员、团委副书记，陕西航空工业管理局团委副书记、局机电办副主任、主任、经贸发展处处长、局长助理、陕航工贸公司总经理、副局长兼陕航工贸公司总经理，陕西航空电气有限责任公司党委书记兼副董事长，现任陕西航空电气有限责任公司党委书记。郭廷仁先生未持有本公司股票，不存在《公司章程》第一百三十五条规定不得担任监事的情形，从未受过中国证监会及其他有关部门的处罚和证券交易所惩戒，也不存在《深圳证券交易所创业板上市公司规范运作指引》第3.1.3条所规定的情形；与其他持有公司5%以上股份的股东、实际控制人存在关联关系，与公司其他董事、监事和高级管理人员不存在关联关系。
中航电测,300114,李岩,监事,李岩先生，男，中国国籍，无境外居留权，1977年2月出生，大专学历。历任中航电测仪器股份有限公司财务部销售会计、出纳，现任中航电测仪器股份有限公司纪检监察审计部审计员。
中航电测,300114,胡阳林,一般高管,"胡阳林先生,男,中国国籍,无境外居留权,1971年2月出生,硕士研究生学历,高级工程师。历任中原电测仪器厂55分厂产品设计员、中测仪器股份有限公司技术部副部长、人力资源部副部长、部长,应变计分厂厂长、党委副书记、纪委书记、工会主席。现任本公司副总经理。"
中航电测,300114,纪刚,一般高管,"纪刚先生,1965年出生,本科学历,研究员级高级工程师。历任国营中原电测仪器厂应变计车间技术员、技术室主任,应变计分厂副厂长、厂长,中航电测应变计分厂厂长、副总工程师兼应变计分厂厂长。现任本公司总法律顾问、董事会秘书。"
中航电测,300114,南新兴,一般高管,"南新兴先生,1968年出生,本科学历,高级会计师。历任中原电测仪器厂财务处会计员、成本室主任,财务处副处长、处长,中航电测仪器股份有限公司财务处处长,财务负责人,财务审计部部长,副总会计师,汉航集团财务部部长,中航电测总会计师、纪委书记。现任陕西华燕航空仪表有限公司董事、本公司副总经理兼总会计师。"
中航电测,300114,杨掌怀,一般高管,"杨掌怀先生,1972年出生,本科学历,工程师,历任中原电测仪器厂52分厂技术员,技术室副主任,中航电测52分厂技术室副主任、58分厂厂长、57分厂厂长、生产部部长。现任本公司副总经理。"
中航电测,300114,张志刚,一般高管,"张志刚先生,1967年出生,本科学历,高级工程师。历任中原电测仪器厂56分厂、52分厂、技术科技术员,电测研究所设计室主任,技术科设计室主任兼技术管理室主任,基建科科长,设备动力部部长,中航电测设备动力部部长、设备动力部部长兼技安环保科科长。现任本公司副总经理。"
中航电测,300114,周豫,一般高管,"周豫先生,男,中国国籍,无境外居留权,1975年5月出生,本科学历,工程师。历任中原电测仪器厂应变计分厂技术员、销售员,中航电测仪器股份有限公司应变计分厂副厂长、传感器三厂副厂长、厂长,应变计分厂厂长、战略规划部部长。现任本公司副总经理兼任石家庄华燕交通科技有限公司总经理"
长盈精密,300115,陈奇星,董事长兼高管,"陈奇星先生,1959年1月出生,中国国籍,大专学历。历任安徽省安庆毛纺厂办公室副主任;安庆市经济贸易委员会宣传干部;深圳市南山区粤海实业公司部门经理;深圳市长盈投资有限公司总经理、执行董事;深圳市海鹏信电子股份有限公司董事。现任本公司董事长。"
长盈精密,300115,张俭,董事兼高管,张俭先生，1964年出生，加拿大籍华人，电子通讯工程博士。曾任芬兰诺基亚RF射频开发工程师、加拿大北方电讯高级研发人员及技术顾问、TCL通讯科技全球工业管理总监、现任本公司副总经理。
长盈精密,300115,朱守力,董事兼高管,"朱守力先生,1981年1月出生,中国国籍。大学本科学历,会计师、审计师,历任本公司出纳、办公室副主任、财务部副经理、经理。现任本公司财务总监。"
长盈精密,300115,陈曦,董事,陈曦女士，1987年出生，中国国籍，英国约克大学数学金融专业理学士，剑桥大学房地产金融专业硕士。曾任国信证券股份有限公司投资银行资本市场部项目经理，安邦资产管理公司投研部研究员。现任新疆长盈粤富股权投资有限公司投资发展部副经理。
长盈精密,300115,刘继,独立董事,刘继先生，1951年出生，中国国籍，律师。曾任职于陕西省纪律检查委员会、深圳市蛇口律师事务所，现任广东度量衡律师事务所律师；2008年起任本公司独立董事。刘继先生未持有公司股票，与公司控股股东、实际控制人、持有公司股份5%以上的股东及其他董事、监事、高级管理人员间不存在关联关系，也不存在受到中国证监会及其他有关部门的处罚和证券交易所惩戒的情形，其任职资格符合《深圳证券交易所股票上市规则》、《公司章程》、《深圳证券交易所创业板上市公司规范运作指引》等的有关规定。
长盈精密,300115,宋晏,独立董事,"宋晏女士,公司独立董事,1982年1月出生,中国国籍。上海市锦天城律师事务所合伙人律师,曾任职于广东君诚律师事务所。现兼任宁波兴瑞电子科技股份有限公司独立董事。2014年5月起担任本公司独立董事。"
长盈精密,300115,杨高宇,独立董事,"杨高宇先生,男,1968年出生,籍贯浙江淳安,中国致公党党员,中国致公党深圳市委会委员,致公党广东社会服务专委会副秘书长。1991年7月毕业于江西财经大学会计学专业,2009--2011年就读于美国纽约理工学院工商管理专业,取得硕士学位。具有的专业资格有:中国注册会计师、中国注册税务师、企业法律顾问、司法会计鉴定人。同时为江西财经大学会计学院客座教授、江西财经大学深圳研究院兼职硕导、香港华人会计师公会首批海外会员、深圳市科工贸信委专家库专家成员、深圳市发改委评审专家库成员。1991年7月至1993年6月历任深圳市雅芳婷布艺有限公司、东莞雅芳婷布艺有限公司、东莞常和电子有限公司、深圳协和集团有限公司、深圳东方药业有限公司的财务会计专员、财务经理、副总经理等职;1993年7月至2013年10月历任深圳长城会计师事务所、深圳市长城会计师事务所有限公司的审计专员、审计经理、合伙人、首席合伙人等职。现任:北京中证天通会计师事务所(特殊普通合伙)深圳分所所长、深圳市永道税务师事务所有限公司合伙人、深圳市中企天华税务筹划事务所有限公司总经理、广东长城司法会计鉴定所所长、深圳市蔚蓝滨海产业投资有限公司董事。同时兼任:深圳市长盈精密技术股份有限公司独立"
长盈精密,300115,詹伟哉,独立董事,"詹伟哉先生,1964年1月出生,中国国籍,中共党员,武汉大学管理学博士,正高级会计师,广东省高级会计师评审委员会专家组成员。历任:西藏大学经济管理系团总支书记、深圳市东辉实业股份有限公司财务部副经理、深圳市侨社实业股份有限公司董事及财务总监、深圳市旅游(集团)股份有限公司财务总监、华安财产保险股份有限公司副总经理、华安保险资产管理中心副总经理;现任:深圳市江财人教育管理有限公司董事长、深圳市德沃投资发展有限公司监事、中国南玻集团股份有限公司独立董事、深圳市维业装饰集团股份有限公司独立董事、重庆市紫建电子股份有限公司独立董事、东莞勤上光电股份有限公司独立董事;社会兼职:江西财经大学客座教授、武汉大学社会保障中心客座教授。"
长盈精密,300115,周建国,独立董事,周建国先生，1955年生，中国国籍，中共党员，经济学硕士，正高级会计师。周建国先生1973年参加工作，1983年7月至1996年2月在江西财经大学任教，先后担任会计系副主任、成人教育处处长，副教授。1996年2月至1997年1月担任深圳中旅信实业有限公司副总经理。1997年2月至2004年9月任深圳市商贸投资控股公司审计部长、计财部部长、总裁助理，兼任深圳市商控实业有限公司董事长、党委书记。2004年9月至今任深圳市投资控股有限公司计划财务部部长、副总经理。2009年1月至今兼任深圳经济特区房地产（集团）股份有限公司董事长、党委书记。周建国先生未持有公司股票，与公司控股股东、实际控制人、持有公司股份5%以上的股东及其他董事、监事、高级管理人员间不存在关联关系，也不存在受到中国证监会及其他有关部门的处罚和证券交易所惩戒的情形，其任职资格符合《深圳证券交易所股票上市规则》、《公司章程》、《深圳证券交易所创业板上市公司规范运作指引》等的有关规定。
长盈精密,300115,陈杭,监事,"陈杭先生,1976年出生,中国国籍,大专学历。历任福立网电子(深圳)有限公司品质部主管、克琛达塑胶电子厂品质部经理兼管理者代表、深圳市长盈精密技术股份有限公司品质部经理。现任本公司监事会主席、总经理助理。"
长盈精密,300115,文乐平,监事,"文乐平女士,1983年出生,中国国籍,大学本科学历。历任深圳市长盈精密技术股份有限公司人事专员、秘书、经理助理、总经理办公室主任。2009年11月至今任公司职工代表监事。"
长盈精密,300115,占敏,监事,"占敏女士,1985年出生,中国国籍,大学本科学历。先后就职于中国农业银行江西省分行和新疆长盈粤富股权投资有限公司,现任本公司监事。"
长盈精密,300115,陈苗圃,一般高管,"陈苗圃,男,1965年出生,中国国籍,华中科技大学工学硕士及中欧国际工商管理学院EMBA工商管理硕士。曾任广东泰科电子(TycoElectronics)经理、运营部总监,泰科电子东莞公司及泰科电子昆山公司总经理,泰科电子CIS中国区营运总监,英国斯瑞克斯(Strix)全球营运董事。拥有16年国际精密连接器企业全面管理工作经验。"
长盈精密,300115,陈明,一般高管,"陈明先生,公司总经理助理兼生产运营总监,1973年出生,中专学历,曾任深圳市菲菱科思通信技术有限公司采购部经理、生产部经理;2007年到本公司工作,任公司总经理助理。陈明先生与公司5%以上股份的股东、实际控制人、公司其他董事、监事、高级管理人员不存在关联关系,并且不持有公司股票。陈明先生未受过中国证券监督管理委员会及其他有关部门的处罚和证券交易所惩戒,能够确保在其任职期间投入足够的时间和精力于公司事务,切实履行高级管理人员应履行的各项职责。"
长盈精密,300115,陈小硕,一般高管,"陈小硕先生,1981年出生,中国国籍,拥有香港永久居留权。东南大学无线电工程系电子信息工程专业工学学士,通信与信息系统专业工学硕士。曾任南京东大移动互联网技术有限公司研发工程师,香港应用科技研究院专业研究员、高级工程师。现任深圳市长盈精密技术股份有限公司总经理,长盈精密香港有限公司总经理。"
长盈精密,300115,丁加斌,一般高管,"丁加斌先生,1967年出生,中国国籍,中专学历。历任金陵石化公司化工分厂总帐会计、主任;深圳格力浦电子有限公司财务部经理;深圳市长盈精密技术有限公司财务总监;现任本公司董事、公司财务总监。丁加斌先生持有公司150,000股股票,与公司控股股东、实际控制人、持有公司股份5%以上的股东及其他董事、监事、高级管理人员间不存在关联关系,也不存在受到中国证监会及其他有关部门的处罚和证券交易所惩戒的情形,其任职资格符合《深圳证券交易所股票上市规则》、《公司章程》、《深圳证券交易所创业板上市公司规范运作指引》等的有关规定。"
长盈精密,300115,丁俊才,一般高管,丁俊才先生，公司副总经理，技术中心主任，1966年出生，中国国籍，大学本科学历。曾任安徽无线电厂工艺部副主任；深圳泰科电子模块有限公司工程部经理；深圳市明日粤海高分子材料有限公司工程部经理；长期从事电子产品零组件产品研究和工艺研究，组织和参与多项专利技术的研究和实施，是公司自动化设备和自动化生产工艺的组织者。2003年到本公司工作，任副总经理；2008年4月至今任本公司副总经理。
长盈精密,300115,董曙光,一般高管,"董曙光先生，1970年出生，新加坡籍华人，大连理工大学机械制造工艺及设备专业学士学位；MBA工商管理硕士。1992年至1996年担任武汉重型机床厂工艺处助理工程师；1996年至2005年先后担任Trend（新加坡）有限公司技术部设计师及经理职务，负责冲压模具开发制造和维修；2005年至2007年担任PATEC（新加坡）有限公司项目经理，负责提供客户冲锻模具和冲床整体方案；2007年至2011年担任泽台精密电子工业（深圳）有限公司协理职务，负责冲压和锻压运营管理。
　　董曙光先生未持有公司股份，与持有公司5%以上股份的股东、实际控制人、其他董事、监事、高级管理人员不存在关联关系；未受过中国证监会及其他有关部门的处罚和证券交易所惩戒；不存在《创业板上市公司规范运作指引》第3.1.3条所规定的情形。"
长盈精密,300115,刘明生,一般高管,"刘明生先生,公司副总经理,负责精密五金产品的技术开发,1977年生,中国国籍,中专学历。曾任深圳市格力浦电子有限公司工程师、开发部副经理;2003到本公司工作,是多项五金产品技术和专利技术的组织者和实施者,组织实施的通信及数码产品屏蔽件被评为“深圳市科技成果”,现任公司副总经理兼五金产品技术开发部经理。"
长盈精密,300115,倪文凯,一般高管,"倪文凯先生,公司副总经理,1965年出生,中国国籍。武汉理工大学金属材料及热处理专业学士学位,曾任职武汉青山造船厂、广州神州集团公司和广东惠而浦微波炉有限公司。1996年加入广东泰科电子(TycoElectronics),先后担任制造部经理、高级营运经理职务,全面负责技术及生产运营工作,现任深圳市长盈精密技术股份有限公司副总经理。"
