晶盛机电,300316,袁桐,独立董事,"袁桐女士,独立董事,1941年出生,本科学历,高级工程师。曾任职于原电子工业部第12研究所、原机电部微电子司、电子部基础产品司、原信息产业部电子信息产品管理司,现任中国电子材料行业协会副理事长兼秘书长。2011年3月至今任本公司第一届董事会独立董事,兼任浙江水晶光电科技股份有限公司独立董事、深圳莱宝高科技股份有限公司独立董事、广东生益科技股份有限公司独立董事。
"
晶盛机电,300316,傅菁菁,监事,"傅菁菁女士,监事,1983年出生,本科学历。2008年至今就职于本公司销售部。2010年11月至今任本公司第一届监事会监事,2011年1月至今任慧翔电液监事。
"
晶盛机电,300316,石刚,监事,"石刚先生,中国国籍,1983年出生,工学硕士。2009年至2013年任公司研发部部长,2013年至2015年任公司研发战略部部长,2015年5月至2016年12月任公司销售中心常务副总监、总监,2016年12月至2019年12月任公司副总裁。石刚先生曾主导参与公司多个项目的研发,在半导体及光伏装备领域拥有丰富的经验,曾获浙江省科学技术二等奖2项、绍兴市科学技术一等奖1项、上虞区科学技术一等奖1项等荣誉。"
晶盛机电,300316,姚雅君,监事,"姚雅君女士,中国国籍,1985年出生,大学本科学历。2008年至今在本公司任职,现任本公司办公室主任,2010年12月至今任本公司职工监事。"
晶盛机电,300316,傅林坚,一般高管,"傅林坚先生,中国国籍,1980年出生,工学博士。2010年7月至11月任公司副总工程师,2010年11月至2016年12月任公司总工程师,2016年12月至2019年12月任公司副总裁、总工程师。傅林坚先生在机电控制与计算机应用领域具有较扎实的理论基础和丰富的应用经验,曾主导参与公司多个重大项目及新产品的攻关和研发。傅林坚先生曾荣获浙江省科学技术一等奖1项、浙江省科学技术二等奖2项、上虞市科学技术一等奖1项、浙江省首批“万人计划”青年拔尖人才等荣誉。"
晶盛机电,300316,陆晓雯,一般高管,"陆晓雯女士,中国国籍,1983年出生,管理学硕士,注册会计师。曾任职于安永华明会计师事务所,历任审计师、高级审计师,2010年11月至2016年12月任公司财务总监、董事会秘书,2016年12月至2019年12月任公司副总裁、财务总监、董事会秘书。陆晓雯女士曾荣获浙江上市公司优秀董事会秘书、新财富金牌董秘等荣誉。"
晶盛机电,300316,张俊,一般高管,"张俊先生,中国国籍,1982年出生,工学硕士。2008年10月至2010年11月任公司副总工程师,2010年11月至2016年12月任公司技术总监,2016年12月至2019年12月任公司副总裁。张俊先生曾荣获浙江省科学技术一等奖1项、浙江省科学技术二等奖1项、上虞市科学技术一等奖1项、浙江省创业创新优秀企业家、政协呼和浩特市赛罕区第四届政协委员、杭州市西湖区第三届优秀科技工作者等荣誉。"
晶盛机电,300316,朱亮,一般高管,"朱亮先生,中国国籍,1979年出生,工学硕士。2007年9月至2010年11月任公司总工程师,2010年11月至2016年3月任公司副总经理,2016年3月至2016年12月任公司董事、副总经理,2016年12月至2019年12月任公司董事、副总裁。朱亮先生曾获浙江省科学技术一等奖1项、浙江省科学技术二等奖2项、绍兴市科学技术一等奖1项、上虞市科学技术一等奖2项、浙江省创业创新优秀企业家、杭州湾上虞经济开发区十佳职场精英等荣誉。"
博晖创新,300318,杜江涛,董事长,"杜江涛：男，1969年生，中国国籍，无永久境外居留权。硕士学位，中国
农工民主党党员。自公司成立以来一直担任董事长。曾担任君正顾问董事长、总
经理，博弘国际（后更名为“君正国际”）董事长。现兼任内蒙君正董事长、锡盟
君正董事长、博昂尼克董事长，并兼任第十二届全国政协委员、农工民主党中央
经济金融工作委员会副主任、中国初级保健基金会理事、全国工商联执行委员、
内蒙古自治区工商联副主席、中欧协会第三届理事会理事、北京理工大学教育基
金会理事。"
博晖创新,300318,卢信群,董事兼高管,"卢信群：男，1966年生，中国国籍，无境外永久居留权，研究生学历，7年-2009年参加清华大学经济管理学院EMBA学习，
并取得毕业证书。现为内蒙君正董事、副总经理，天弘基金副董事长，君正国际董事。最近5年为本公司监事。"
博晖创新,300318,宋锐,董事兼高管,"宋锐：男，1979年生，中国国籍，无境外永久居留权，大学学历。最近5年为本公司董事、副总经理、广州博晖执行董
事。"
博晖创新,300318,杨奇,董事兼高管,"杨奇：男，1959年生，中国国籍，无境外永久居留权，大学学历。最近5年为本公司董事、副总经理，博昂尼克董事、
总经理。"
博晖创新,300318,章雷,董事,章雷：男，1962年生，中国国籍，无境外永久居留权，大学学历。最近5年为本公司董事、副总经理、博昂尼克监事。
博晖创新,300318,周朋,董事,"周朋:男,1957年生,中国国籍,拥有美国永久居留权,博士学历。曾任美国Sepracor公司高级研究员,美国BristolMyersSquibb公司资深研究员,美国KionixInc.微流体部门主管。现任美国RheonixInc.首席科学家、高级研发副总,北京博昂尼克微流体技术有限公司董事、副总经理,本公司董事。"
博晖创新,300318,丁家华,独立董事,"丁家华：男，1945年生，中国国籍，无境外永久居留权，研究生学历。历任吉林省卫生防疫站中心实验室主任、食品卫生监督检查所所长、卫生防疫站副站长；吉林省临床检验中心主任，中华医学会检验分会第四、五、六届常委，吉林省医学会理事，吉林省检验分会主任委员，中国医院协会临床检验专科委员会常委。现任卫生部临床检验标准化委员会委员、中华医学科技奖评审委员会委员、中华医学会检验分会顾问、ISO15189评审员、吉林省医学会理事、吉林省检验学会名誉主任委员等职。现任本公司独立董事，兼任长春迪瑞医疗科技股份有限公司独立董事。
丁家华先生还曾获国家科技进步一等奖、卫生部科技进步二等奖、吉林省科技进步三等奖等奖项，参与起草了《医疗机构临床实验室管理办法》、参加编写了《全国临床检验操作规程》（第三版）。1986年被评为吉林省突出贡献专家，1992年获首批国务院政府特殊津贴，1998年获吉林省首批省管优秀专家称号。"
博晖创新,300318,康熙雄,独立董事,"康熙雄:男,1952年生,中国国籍,无境外永久居留权,博士学位。现任国家神经系统疾病临床研究中心、首都医科大学北京天坛医院检验诊断教授、中国生化与分子生物临床应用分委会会长、中国医疗器械行业协会现场快速检测委员会会长、中国生物医学工程学会医学检验分会会长、北京医学检验学会会长。基蛋生物科技股份有限公司、博爱新开源医疗科技集团股份有限公司、广州阳普医疗科技股份有限公司独立董事,上海百傲科技股份有限公司董事,本公司独立董事。"
博晖创新,300318,刘俊勇,独立董事,刘俊勇：男，1970年生，中国国籍，无境外永久居留权。会计专业博士、教授，硕士生导师。2005年至今任职于中央财经大学会计学院，2010年起任中央财经大学会计学院副院长。现任本公司独立董事，兼任北京巴士传媒股份有限公司、抚顺佳化化学股份有限公司、山东国强五金科技股份有限公司独立董事。
博晖创新,300318,杜江虹,监事,"杜江虹：女，1968年生，中国国籍，无境外永久居留权，大学学历，中级会计师。最近5年为本公司董事、总经理，博
昂尼克董事。"
博晖创新,300318,李志军,监事,"李志军：男，1968年生，中国国籍，无境外永久居留权。1994年至2000年就职于北京苏晖仪器有限公司，最近5年为本
公司职工监事。"
博晖创新,300318,刘令强,监事,"刘令强:男,1980年生,中国国籍,无境外永久居留权。2001年起就职于本公司。现任本公司监事。"
博晖创新,300318,刘敏,一般高管,刘敏：女，1967年生，中国国籍，无境外永久居留权，大学学历。最近5年为本公司副总经理、董事会秘书。
博晖创新,300318,牛树荟,一般高管,"牛树荟:女,1973年生,中国国籍,无境外永久居留权,会计学硕士,高级会计师。最近5年就职本公司;现任本公司副总经理。"
华灿光电,300323,周福云,董事长,"周福云先生,1963年出生,中国国籍,无境外永久居留权,大专学历,现任本公司名誉董事长、董事。周福云先生2005年11月参与创建本公司并出任董事,2007年5月起担任本公司董事长,2017年离任董事长。周福云先生目前同时担任浙江华迅董事长、华灿光电(浙江)有限公司执行董事、义乌市联云彩印包装有限公司监事。"
华灿光电,300323,边迪斐,董事兼高管,"边迪斐先生,1972年出生,中国国籍,无境外永久居留权,烟台大学机械设计与制造专业学士,现任本公司董事、副总裁。边迪斐先生曾任成都筑华技贸有限公司工程师,东方通信股份有限公司分公司总经理,山东戴革通信技术有限公司总经理,摩托罗拉(中国)电子有限公司销售经理;2008年12月起在本公司任职,历任总裁助理、副总裁。边迪斐先生拥有10余年的市场营销方面的丰富工作经验,目前同时担任武汉友生董事。
"
华灿光电,300323,刘榕,董事兼高管,"刘榕先生,1976年出生,中国国籍,无境外永久居留权,美国亚历桑那州立大学材料科学与工程专业博士,现任本公司副董事长、董事、总裁。刘榕先生2007年9月加入本公司,历任副总经理、总经理、总裁。刘榕先生目前同时担任湖北省工商联副主席、上海灿融董事长、石河子友生董事长、蓝晶科技董事、华灿光电(浙江)有限公司总经理。"
华灿光电,300323,陈海辉,董事,"陈海辉先生,1975年出生,中国国籍,无境外永久居留权。毕业于同济大学,工业电气自动化学士。曾任上海机场集团公司计算机中心工程师,施乐(中国)有限公司历任战略部经理、市场部经理、渠道及运营部经理,杰尔系统(上海)公司大中国区销售运营高级经理,欧司朗(中国)有限公司高级销售经理;2013年至今担任恩耐激光技术(上海)有限公司中国区销售总监。"
华灿光电,300323,章苏阳,董事,"章苏阳先生，1958年出生，中国国籍，无境外永久居留权，中欧国际工商管理学院EMBA，现任本公司董事。章苏阳先生曾任邮电部上海520厂副厂长，上海万鑫实业有限公司总经理，上海太平洋技术创业有限公司总经理，1995年至今担任IDG技术创业投资基金副总裁及普通合伙人之成员，2005年至今担任IDG-AccelChinaGrowthFundIIL.P.普通合伙人之成员，2006年至今担任IDG资本投资顾问（北京）有限公司副总经理，2010年至今担任北京和谐成长投资中心（有限合伙）投资决策委员会成员。自2008年1月起担任本公司董事。章苏阳先生目前同时担任天津九安医疗电子股份有限公司副董事长、上海瑞慈健康体检管理股份有限公司董事、Ctrip.comInternational,Ltd．（携程旅行网）独立董事、TudouHoldingsLimited（上海全土豆网络科技有限公司）董事、ChinaKanghuiHoldings（康辉控股（中国）公司）董事、Chaintea(CaymanIslands)HoldingCorp.（茶人控股公司）董事、MedsphereInternationalHoldings,Inc.（迈德医疗科技（上海）有限公司）董事、SundiaInvestmentGroupLtd.（桑迪亚医药技术（上海）有限公司）董事、ChinaMedicalEducationInternationalHoldingCo.,Ltd"
华灿光电,300323,关白玉,独立董事,"关白玉女士,1950年10月出生,中国国籍,汉族,无境外永久居留权。南开大学半导体物理学士。关白玉女士曾任天津电子仪表局综合研究所助理工程师、中国电子器件工业总公司半导体事业部工程师、电子工业部微电子器件局主任科员、机械电子工业部微电子司副处长、电子工业部基础产品重大工程司副处长、电子工业部电子产品管理司处长、工业和信息化部电子信息司处长、工业和信息化部电子信息司巡视员。2012年1月至今担任中国半导体照明/LED产业与应用联盟秘书长,同时担任天通控股股份有公司独立董事。"
华灿光电,300323,谢获宝,独立董事,谢获宝先生，1967年出生，中国国籍，无境外永久居留权，武汉大学经济学专业博士，现任本公司独立董事。谢获宝先生曾任武汉大学会计系助教、讲师、副教授；现任武汉大学会计系教授、博士生导师；2011年2月起担任本公司独立董事。谢获宝先生目前同时担任楚天高速股份有限公司独立董事、浙江森马服饰股份有限公司独立董事、武汉中博生物股份有限公司独立董事及汉口银行股份有限公司独立董事。
华灿光电,300323,叶志镇,独立董事,"叶志镇先生,1955年出生,中国国籍,无境外永久居留权,浙江大学光学薄膜专业博士,现任本公司独立董事。叶志镇先生曾任浙江大学材料系讲师、副教授、教授,浙江大学材料系硅材料国家重点实验室副主任、主任,浙江大学材料与化工学院副院长以及美国麻省理工学院访问科学家;现任浙江大学材料科学与工程学系系主任、教授、博士生导师;2011年2月起担任本公司独立董事。
"
华灿光电,300323,曾丽君,监事,"曾丽君女士,1982年出生,中国国籍,无境外永久居留权。毕业于空军工程大学外国语言文学专业,本科学历。曾丽君女士现任本公司采购部经理、工会主席。曾任职于武汉吉隆过滤技术有限公司,任行政人事副经理;2006年11月起在本公司任职,历任人力资源部经理、综合事务部经理。
"
华灿光电,300323,杨忠东,监事,"杨忠东先生,1969年出生,中国国籍,无境外永久居留权,硕士学历,现任本公司监事。杨忠东先生2011年2月起担任本公司监事。杨忠东先生目前同时担任义乌市升平玩具有限公司董事长、浙江华迅投资有限公司监事、驭风翔云(北京)航空科技有限公司执行董事。"
华灿光电,300323,俞信华,监事,"俞信华先生,1974年1月出生,中国国籍,无境外永久居留权,浙江大学材料学专业学士,长江商学院MBA,现任本公司董事。俞信华先生2006年至2011年担任IDG资本投资顾问(北京)有限公司副总裁,2012年起任爱奇投资顾问(上海)有限公司合伙人。2016年4月起担任本公司董事。2017年5月起担任本公司董事长。俞信华先生目前同时担任西安瑞联新材料股份有限公司独立董事、NewnagyHoldings,Inc董事、SkySolarHoldingsCo.,Ltd董事、欣旺达电子股份有限公司非独立董事、上海爱旭新能源股份有限公司董事、以及中微半导体设备(上海)股份有限公司监事。"
华灿光电,300323,韩继东,一般高管,"继东先生,1970年出生,中国国籍,无境外永久居留权,大专学历,注册会计师,现任本公司董事会秘书、财务总监。韩继东先生曾任可口可乐(中国)实业有限公司子公司财务总监,遵义赛德水泥有限公司财务总监;2011年1月起进入本公司任财务总监。2016年9月担任公司董事会秘书。已获得深圳证券交易所颁发的董事会秘书资格证书。"
华灿光电,300323,王江波,一般高管,"王江波先生,1975年出生,中国国籍,无境外永久居留权。美国亚历桑那州立大学电子工程专业博士,现任本公司副总裁、华灿光电(浙江)有限公司总经理、华灿光电(苏州)有限公司总经理。曾任美国亚历桑那州立大学研究员,美国PhllipsLumileds照明公司高级开发研究员。王江波先生于2010年5月加入本公司,曾任公司总裁助理兼研发部经理。"
华灿光电,300323,王力明,一般高管,"王力明先生,1978年出生,中国国籍,无境外永久居留权。大连交通大学材料学硕士,现任本公司副总裁、苏州子公司总经理。王力明先生曾任东莞新科磁电制品厂品质经理,大连路美芯片科技有限公司品质及客户服务负责人,大连路美芯片科技有限公司红黄光事业部负责人,大连路美芯片科技有限公司红黄、蓝绿生产、动力设备副总经理,大连路美芯片科技有限公司总经理(代)。王力明先生于2013年10月加入本公司,曾任芯片生产总监。"
华灿光电,300323,魏世祯,一般高管,魏世祯先生，1972年出生，中国台湾籍，台湾成功大学微电子专业博士，现任本公司副总裁。魏世祯先生曾任台湾国联光电工程师，台湾联亚光电副经理，台湾联铨科技经理，台湾元砷光电处长；2007年8月加入本公司，历任副总经理、副总裁，主管外延芯片研发与生产工作。魏世祯先生拥有10余年LED行业著名公司的生产管理经验，于2009年作为LED领域高层次人才及经营管理专家入选武汉市东湖高新区“3551人才引进计划”，并于2011年被授予“湖北省特聘专家”荣誉称号。魏世祯先生目前同时担任香港华臻董事。
华灿光电,300323,叶爱民,一般高管,叶爱民先生，1968年出生，中国国籍，无境外永久居留权，北京大学中国古代文学专业硕士，现任本公司董事、副总裁、董事会秘书。叶爱民先生曾任大连电业局编辑，上海西门子移动通信有限公司市场主管，北京因特雷博互联网咨询有限公司总裁、高级顾问，浙江大河影视文化有限公司执行董事；2005年11月参与创建本公司并出任董事、经理、副总经理、副总裁。叶爱民先生目前同时担任上海灿融董事、武汉友生董事、天福华能监事。
凯利泰,300326,秦杰,董事长,"秦杰先生，公司董事，美国国籍，持有编号为463****02的美国护照，有永久境外居留权。1964年9月出生。电子工程、生物医学工程硕士。曾任B.BraunMedical,Inc.项目经理、Medtronic,Inc.研发部经理、Cardima,Inc.技术总监。"
凯利泰,300326,袁征,董事兼高管,"袁征先生,1963年3月出生,现任公司董事长,董事,总经理,中国国籍,生物学学士。曾任职中国预防医学科学院上海寄生虫病研究所、上海摩尔生物技术有限公司总经理。2005年至今在本公司工作。"
凯利泰,300326,PhilipWang（汪立）,董事,"PHILIPLIWANG（汪立）先生，美国国籍，1968年11月出生，工商管理硕士。曾任美国Guidant公
司市场和销售经理、美国Medtronic公司亚太区市场销售总监、微创医疗首席市场官及首席运营官，2012
年11月至今任上海安通医疗科技有限公司董事长。"
凯利泰,300326,李建祥,董事,"李建祥,男,1961年出生,高中学历,无境外永久居留权。张家港医疗行业会长,曾获张家港锦丰镇“优秀企业家”称号。曾任江苏金鹿集团骨科器械组组长,1996年至今担任江苏艾迪尔医疗科技股份有限公司董事长兼总经理。
"
凯利泰,300326,鲁旭波,独立董事,"鲁旭波先生,现任公司董事,男,1980年3月,中国国籍,无境外居留权,本科学历。2005年12月至2016年6月任职于浙江康盛股份有限公司,历任董秘助理、证券事务代表、投资部经理、董事会秘书、董事职务。现任杭州安益资产管理有限公司副总经理、风控合规负责人,兼任浙江安逸智库教育基金会秘书长、张家口祥音生物科技有限公司董事。"
凯利泰,300326,原红旗,独立董事,"原红旗先生,公司独立董事,中国国籍,无永久境外居留权。1970年5月出生,会计学博士,教授,中国注册会计师非执业会员。现任复旦大学管理学院教授、博士生导师。
"
凯利泰,300326,张维淳,独立董事,张维淳先生，公司独立董事，美国国籍，持有编号为452****12的美国护照，有永久境外居留权。1968年11月出生，工商管理硕士。曾任美国德意志银行投资银行部经理、美国私募股权和对冲基金AveraGlobalPartners高级投资经理、中国成长南方并购基金公司首席执行官与执行董事、中国成长北方并购基金公司首席财务官与执行董事、传隆资本集团合伙人。2005年5月至今任GlobalVestorCapitalPartners的合伙人，2009年1月至今任天瑞控股有限公司独立董事，2010年11月至今任北京凯普德资本管理有限责任公司总经理，2011年5月至今任中国成长股权投资有限公司独立董事。
凯利泰,300326,周烨,监事,"周烨女士,公司监事,中国国籍,无永久境外居留权,1984年4月出生,本科学历,2007年2月至今在本公司工作,现任总经理办公室运营管理部总监。"
凯利泰,300326,周志强,监事,"周志强先生,公司监事会主席,中国国籍,无永久境外居留权,1954年9月出生,大专学历。曾任东航综合训练有限公司副总经理、董事。2010年1月至今,在本公司任监事。"
凯利泰,300326,朱寒青,监事,"朱寒青女士,公司监事,中国国籍,无永久境外居留权,1965年10月出生,本科学历,2008年12月至今在本公司工作,现任公司总经理办公室国际合作部总监。2018年3月任上海意久泰医疗科技有限公司董事、副总经理职务。"
凯利泰,300326,丁魁,一般高管,"丁魁先生,公司副总经理、董事会秘书,无永久境外居留权,1982年6月出生,本科学历,2003年6月至2005年8月就职于云南国际信托投资有限公司资产管理部,2005年8月至2012年7月就职于国金证券股份有限公司投资银行部,2012年8月至今在本公司工作"
凯利泰,300326,赖卫国,一般高管,"赖卫国,男,1971年出生,本科学历,现任上海凯利泰医疗科技股份有限公司副总经理,赖卫国先生具备14年以上的医疗器械行业从业经验,曾先后就职于史赛克有限公司、施乐辉有限公司,曾担任施乐辉有限公司内窥镜部门外科事业部华东区销售总监,先进伤口管理事业部中国区业务总监,具备丰富的医疗器械行业从业经验。
赖卫国先生不持有本公司股权,不在其他单位兼职,与持有公司5%以上股份的股东、公司其他董事、监事、高级管理人员之间不存在关联关系,不存在受到中国证监会及其他有关部门的处罚和证券交易所惩戒的情形
"
凯利泰,300326,汪远根,一般高管,汪远根先生，公司财务负责人，中国国籍，无永久境外居留权。1974年4月出生，硕士学历。曾任上海宝钢实业有限公司财务分析主管、西派克（上海）泵业有限公司财务经理、诺基亚西门子通信传输系统（上海）有限公司财务负责人，2009年11月至今在本公司工作，任财务部负责人。
凯利泰,300326,王正民,一般高管,"王正民先生,1968年5月出生,中国国籍,无永久境外居留权,临床医学本科学历,2007年2月进入本公司工作,现任公司副总经理。"
凯利泰,300326,卫青梅,一般高管,"卫青梅女士,公司副总经理,中国国籍,无永久境外居留权,1973年7月出生,本科学历,2005年至今在本公司工作。"
中颖电子,300327,傅启明,董事长,"傅启明先生,1958年出生,中国香港籍,毕业于台湾交通大学电信工程学系,学士,自1983年起从事集成电路设计业,历任联华电子股份有限公司集成电路设计部门设计工程师,飞利浦集成电路设计部门资深工程师,联华电子股份有限公司集成电路设计部门项目经理,联咏科技股份有限公司商用产品事业部市场专案企划经理,中颖香港董事、总经理等职务。2002年加入本公司,现任本公司董事长,威朗国际董事,中颖科技董事、总经理,西安中颖董事长兼总经理,合肥中颖执行董事。"
中颖电子,300327,范姜群权,董事兼高管,"范姜群权男,1965年出生,中国台湾籍,毕业于台湾中原大学电机工程研究所,硕士,历任欣象科技集成电路设计工程师,联华电子股份有限公司集成电路设计资深工程师、副理,联咏科技股份有限公司副理,中颖香港副总经理等职务,1998年加入本公司,现任本公司副总经理、中颖科技副总经理。
"
中颖电子,300327,宋永皓,董事兼高管,"宋永皓先生,1962年出生,中国香港籍,毕业于台湾科技大学,学士,自1989年起从事集成电路设计业,历任联华电子股份有限公司商用产品事业部集成电路设计工程师、行销经理,联咏科技股份有限公司商用产品事业部行销经理,迅捷科技股份有限公司副总经理,中颖香港董事、副总经理等职务。2002年加入本公司,现任本公司董事、总经理,中颖科技副总经理,合肥中颖总经理。"
